{
  "schema_version": "risk_result_v1",
  "case_id": "20200501_00_048",
  "source_file": "handoff/mazu_like/mazu_like_20200501_00_lead048.nc",
  "initial_time": "2020-05-01T00:00:00Z",
  "lead_time_hours": 48,
  "valid_start_time": "2020-05-02T00:00:00Z",
  "valid_end_time": "2020-05-03T00:00:00Z",
  "region_id": "SA-09",
  "region_name": "Jazan Region",
  "hazard": "heavy_rain",
  "rule_id": "heavy_rain_candidate_region_season_p90_p95",
  "rule_status": "draft",
  "indicator_summary": {
    "reference_period": "MAM",
    "precip_spatial_p95_mm": 2.8983252,
    "precip_medium_threshold_mm": 10.0,
    "precip_high_threshold_mm": 20.0,
    "precipitation_stage": "below_medium",
    "pwat_weighted_mean": 44.220799,
    "ivt_weighted_mean": 77.053787,
    "wind850_speed_weighted_mean": 1.9868161,
    "omega500_weighted_mean_pa_s-1": -0.0045434943,
    "support_count": 2
  },
  "supporting_evidence": [
    {
      "indicator": "pwat",
      "metric": "weighted_mean",
      "value": 44.220799,
      "comparison": ">=",
      "threshold": 39.97816,
      "unit": "kg m-2",
      "role": "support",
      "reference_period": "MAM"
    },
    {
      "indicator": "omega500",
      "metric": "weighted_mean",
      "value": -0.0045434943,
      "comparison": "<",
      "threshold": 0.0,
      "unit": "Pa s-1",
      "role": "support"
    }
  ],
  "contradicting_evidence": [
    {
      "indicator": "daily_precip_total",
      "metric": "spatial_p95",
      "value": 2.8983252,
      "comparison": ">=",
      "threshold": 10.0,
      "unit": "mm",
      "role": "primary",
      "reference_period": "MAM"
    },
    {
      "indicator": "ivt",
      "metric": "weighted_mean",
      "value": 77.053787,
      "comparison": ">=",
      "threshold": 98.274788,
      "unit": "kg m-1 s-1",
      "role": "support",
      "reference_period": "MAM"
    },
    {
      "indicator": "wind850_speed",
      "metric": "weighted_mean",
      "value": 1.9868161,
      "comparison": ">=",
      "threshold": 3.6882299,
      "unit": "m s-1",
      "role": "support",
      "reference_period": "MAM"
    }
  ],
  "missing_evidence": [],
  "verification": null,
  "created_at": "2026-07-17T00:00:00Z",
  "risk_level": "low",
  "risk_score": 0.0,
  "confidence": "medium",
  "description_zh": "候选暴雨规则草案：降水阶段 below_medium，辅助支持 2/4。"
}
